[
  {
    "glyphon": "அ",
    "interphon": "a",
    "orthoset": "tami1289-modern",
    "context": ["initial", "medial", "standalone"],
    "examples": [
      { "word": "அப்பா", "pronunciation": "appaː", "meaning": "father" },
      { "word": "மரம்", "pronunciation": "maɾam", "meaning": "tree" },
      { "word": "அ", "pronunciation": "a", "meaning": "the letter 'a'" }
    ]
  },
  {
    "glyphon": "ஆ",
    "interphon": "aː",
    "orthoset": "tami1289-modern",
    "context": ["initial", "medial", "final", "standalone"],
    "examples": [
      { "word": "ஆடு", "pronunciation": "aːɖu", "meaning": "goat" },
      { "word": "காடு", "pronunciation": "kaːɖu", "meaning": "forest" },
      { "word": "வா", "pronunciation": "ʋaː", "meaning": "come" }
    ]
  },
  {
    "glyphon": "இ",
    "interphon": "i",
    "orthoset": "tami1289-modern",
    "context": ["initial", "medial", "standalone"],
    "examples": [
      { "word": "இலை", "pronunciation": "ilai̯", "meaning": "leaf" },
      { "word": "விழி", "pronunciation": "ʋiɻi", "meaning": "eye" },
      { "word": "இ", "pronunciation": "i", "meaning": "the letter 'i'" }
    ]
  },
  {
    "glyphon": "ஈ",
    "interphon": "iː",
    "orthoset": "tami1289-modern",
    "context": ["initial", "medial", "final", "standalone"],
    "examples": [
      { "word": "ஈடு", "pronunciation": "iːɖu", "meaning": "equal" },
      { "word": "வீடு", "pronunciation": "ʋiːɖu", "meaning": "house" },
      { "word": "தீ", "pronunciation": "t̪iː", "meaning": "fire" }
    ]
  },
  {
    "glyphon": "உ",
    "interphon": "u",
    "orthoset": "tami1289-modern",
    "context": ["initial", "medial", "standalone"],
    "examples": [
      { "word": "உடல்", "pronunciation": "uɖal", "meaning": "body" },
      { "word": "முகம்", "pronunciation": "muɣam", "meaning": "face" },
      { "word": "உ", "pronunciation": "u", "meaning": "the letter 'u'" }
    ]
  },
  {
    "glyphon": "ஊ",
    "interphon": "uː",
    "orthoset": "tami1289-modern",
    "context": ["initial", "medial", "final", "standalone"],
    "examples": [
      { "word": "ஊர்", "pronunciation": "uːr", "meaning": "town/village" },
      { "word": "பூ", "pronunciation": "puː", "meaning": "flower" },
      { "word": "வரவூர்", "pronunciation": "ʋaɾaʋuːr", "meaning": "to welcome" }
    ]
  },
  {
    "glyphon": "எ",
    "interphon": "e",
    "orthoset": "tami1289-modern",
    "context": ["initial", "medial", "standalone"],
    "examples": [
      { "word": "எல்லாம்", "pronunciation": "ellaːm", "meaning": "all" },
      { "word": "செய்", "pronunciation": "t͡ʃej", "meaning": "do" },
      { "word": "எ", "pronunciation": "e", "meaning": "the letter 'e'" }
    ]
  },
  {
    "glyphon": "ஏ",
    "interphon": "eː",
    "orthoset": "tami1289-modern",
    "context": ["initial", "medial", "final", "standalone"],
    "examples": [
      { "word": "ஏன்", "pronunciation": "eːn", "meaning": "why" },
      { "word": "தேன்", "pronunciation": "t̪eːn", "meaning": "honey" },
      { "word": "கதவே", "pronunciation": "kat̪aʋeː", "meaning": "door (emphatic)" }
    ]
  },
  {
    "glyphon": "ஐ",
    "interphon": "ai̯",
    "orthoset": "tami1289-modern",
    "context": ["initial", "medial", "final", "standalone"],
    "examples": [
      { "word": "ஐந்து", "pronunciation": "ai̯n̪t̪u", "meaning": "five" },
      { "word": "பை", "pronunciation": "pai̯", "meaning": "bag" },
      { "word": "ஐ", "pronunciation": "ai̯", "meaning": "the letter 'ai'" }
    ]
  },
  {
    "glyphon": "ஒ",
    "interphon": "o",
    "orthoset": "tami1289-modern",
    "context": ["initial", "medial", "standalone"],
    "examples": [
      { "word": "ஒரு", "pronunciation": "oɾu", "meaning": "one" },
      { "word": "கொடி", "pronunciation": "koɖi", "meaning": "flag" },
      { "word": "ஒ", "pronunciation": "o", "meaning": "the letter 'o'" }
    ]
  },
  {
    "glyphon": "ஓ",
    "interphon": "oː",
    "orthoset": "tami1289-modern",
    "context": ["initial", "medial", "final", "standalone"],
    "examples": [
      { "word": "ஓடு", "pronunciation": "oːɖu", "meaning": "run" },
      { "word": "போ", "pronunciation": "poː", "meaning": "go" },
      { "word": "சோறு", "pronunciation": "t͡ʃoːru", "meaning": "cooked rice" }
    ]
  },
  {
    "glyphon": "ஔ",
    "interphon": "au̯",
    "orthoset": "tami1289-modern",
    "context": ["initial", "medial", "standalone"],
    "examples": [
      { "word": "ஔவை", "pronunciation": "au̯vai̯", "meaning": "Avvaiyar (name)" },
      { "word": "கௌரவம்", "pronunciation": "kau̯ɾaʋam", "meaning": "honor/respect" },
      { "word": "ஔ", "pronunciation": "au̯", "meaning": "the letter 'au'" }
    ]
  },
  {
    "glyphon": "ஃ",
    "interphon": "ˑ",
    "orthoset": "tami1289-modern",
    "context": ["medial"],
    "examples": [
      { "word": "வஃக", "pronunciation": "vaˑka", "meaning": "to bend (archaic)" },
      { "word": "அஃது", "pronunciation": "aˑt̪u", "meaning": "that thing (archaic)" }
    ],
    "notes": "Āytam: rare archaic character used between certain consonants"
  },
  {
    "glyphon": "க்",
    "interphon": "k",
    "orthoset": "tami1289-modern",
    "context": ["initial", "medial", "final"],
    "examples": [
      { "word": "கல்", "pronunciation": "kal", "meaning": "stone" },
      { "word": "பக்கம்", "pronunciation": "pakkam", "meaning": "side/page" },
      { "word": "மரக்", "pronunciation": "maɾak", "meaning": "wooden (as prefix)" }
    ]
  },
  {
    "glyphon": "ங்",
    "interphon": "ŋ",
    "orthoset": "tami1289-modern",
    "context": ["medial", "final"],
    "examples": [
      { "word": "அங்கே", "pronunciation": "aŋgeː", "meaning": "there" },
      { "word": "பொங்கல்", "pronunciation": "poŋgal", "meaning": "a harvest festival/dish" },
      { "word": "மரங்", "pronunciation": "maɾaŋ", "meaning": "trees (as prefix)" }
    ]
  },
  {
    "glyphon": "ச்",
    "interphon": "t͡ʃ",
    "orthoset": "tami1289-modern",
    "context": ["initial", "medial", "final"],
    "examples": [
      { "word": "சட்டை", "pronunciation": "t͡ʃaʈʈai̯", "meaning": "shirt" },
      { "word": "அச்சம்", "pronunciation": "at͡ʃt͡ʃam", "meaning": "fear" },
      { "word": "மரச்", "pronunciation": "maɾat͡ʃ", "meaning": "wooden (as prefix)" }
    ]
  },
  {
    "glyphon": "ஞ்",
    "interphon": "ɲ",
    "orthoset": "tami1289-modern",
    "context": ["medial", "final"],
    "examples": [
      { "word": "பஞ்சு", "pronunciation": "paɲt͡ʃu", "meaning": "cotton" },
      { "word": "ஆஞ்சனேயர்", "pronunciation": "aːɲt͡ʃaneːjar", "meaning": "Hanuman" },
      { "word": "எஞ்", "pronunciation": "eɲ", "meaning": "remain (as prefix)" }
    ]
  },
  {
    "glyphon": "ட்",
    "interphon": "ʈ",
    "orthoset": "tami1289-modern",
    "context": ["medial", "final"],
    "examples": [
      { "word": "வீட்டு", "pronunciation": "ʋiːʈʈu", "meaning": "of the house" },
      { "word": "கட்டம்", "pronunciation": "kaʈʈam", "meaning": "stage/phase" },
      { "word": "வீட்", "pronunciation": "ʋiːʈ", "meaning": "house (as prefix)" }
    ]
  },
  {
    "glyphon": "ண்",
    "interphon": "ɳ",
    "orthoset": "tami1289-modern",
    "context": ["medial", "final"],
    "examples": [
      { "word": "கண்", "pronunciation": "kaɳ", "meaning": "eye" },
      { "word": "பண்பு", "pronunciation": "paɳpu", "meaning": "culture/quality" },
      { "word": "மண்", "pronunciation": "maɳ", "meaning": "soil/earth" }
    ]
  },
  {
    "glyphon": "த்",
    "interphon": "t̪",
    "orthoset": "tami1289-modern",
    "context": ["initial", "medial", "final"],
    "examples": [
      { "word": "பத்து", "pronunciation": "pat̪t̪u", "meaning": "ten" },
      { "word": "சித்தம்", "pronunciation": "t͡ʃit̪t̪am", "meaning": "mind" },
      { "word": "வித்", "pronunciation": "ʋit̪", "meaning": "seed (as prefix)" }
    ]
  },
  {
    "glyphon": "ந்",
    "interphon": "n̪",
    "orthoset": "tami1289-modern",
    "context": ["medial", "final"],
    "examples": [
      { "word": "அந்த", "pronunciation": "an̪t̪a", "meaning": "that" },
      { "word": "மந்தி", "pronunciation": "man̪t̪i", "meaning": "monkey" },
      { "word": "என்", "pronunciation": "en̪", "meaning": "my" }
    ]
  },
  {
    "glyphon": "ப்",
    "interphon": "p",
    "orthoset": "tami1289-modern",
    "context": ["initial", "medial", "final"],
    "examples": [
      { "word": "புத்தகம்", "pronunciation": "put̪t̪akam", "meaning": "book" },
      { "word": "அப்பா", "pronunciation": "appaː", "meaning": "father" },
      { "word": "தாப்", "pronunciation": "t̪aːp", "meaning": "jump (as prefix)" }
    ]
  },
  {
    "glyphon": "ம்",
    "interphon": "m",
    "orthoset": "tami1289-modern",
    "context": ["medial", "final"],
    "examples": [
      { "word": "அம்மா", "pronunciation": "ammaː", "meaning": "mother" },
      { "word": "நம்பு", "pronunciation": "nambu", "meaning": "believe" },
      { "word": "மரம்", "pronunciation": "maɾam", "meaning": "tree" }
    ]
  },
  {
    "glyphon": "ய்",
    "interphon": "j",
    "orthoset": "tami1289-modern",
    "context": ["medial", "final"],
    "examples": [
      { "word": "ஐயா", "pronunciation": "ai̯jaː", "meaning": "sir" },
      { "word": "செய்தி", "pronunciation": "t͡ʃejt̪i", "meaning": "news" },
      { "word": "பொய்", "pronunciation": "poj", "meaning": "lie/falsehood" }
    ]
  },
  {
    "glyphon": "ர்",
    "interphon": "ɾ",
    "orthoset": "tami1289-modern",
    "context": ["medial", "final"],
    "examples": [
      { "word": "அர்த்தம்", "pronunciation": "aɾt̪t̪am", "meaning": "meaning" },
      { "word": "பர்வதம்", "pronunciation": "paɾʋat̪am", "meaning": "mountain" },
      { "word": "ஊர்", "pronunciation": "uːɾ", "meaning": "town/village" }
    ]
  },
  {
    "glyphon": "ல்",
    "interphon": "l",
    "orthoset": "tami1289-modern",
    "context": ["medial", "final"],
    "examples": [
      { "word": "கல்", "pronunciation": "kal", "meaning": "stone" },
      { "word": "பல்", "pronunciation": "pal", "meaning": "tooth" },
      { "word": "நல்ல", "pronunciation": "nalla", "meaning": "good" }
    ]
  },
  {
    "glyphon": "வ்",